[
  {
    "clip_id": "KING_DRUM_001",
    "source_id": "KING_DRUM",
    "speaker": "Martin Luther King Jr.",
    "asset_id": "KING_DRUM",
    "media_path": null,
    "source_sha256": null,
    "source_in_ms": null,
    "source_out_ms": null,
    "verbatim_transcript": null,
    "context_before": null,
    "context_after": null,
    "claim_class": "christian_ethics",
    "narrative_function": "Thematic spine",
    "verification_status": "source_confirmed",
    "rights_status": "unknown",
    "rights_evidence_path": null,
    "context_review_path": null,
    "acquisition_evidence_path": null,
    "reviewer": null,
    "publish_approved": false,
    "editorial_notes": "King Estate and recording rights; obtain authorization/review",
    "caption_cues": []
  },
  {
    "clip_id": "REAGAN_XMAS_001",
    "source_id": "REAGAN_XMAS",
    "speaker": "Ronald Reagan",
    "asset_id": "REAGAN_XMAS",
    "media_path": null,
    "source_sha256": null,
    "source_in_ms": null,
    "source_out_ms": null,
    "verbatim_transcript": null,
    "context_before": null,
    "context_after": null,
    "claim_class": "christological_argument",
    "narrative_function": "Christological statement",
    "verification_status": "source_confirmed",
    "rights_status": "unknown",
    "rights_evidence_path": null,
    "context_review_path": null,
    "acquisition_evidence_path": null,
    "reviewer": null,
    "publish_approved": false,
    "editorial_notes": "Confirm recording and its legal status",
    "caption_cues": []
  },
  {
    "clip_id": "JFK_TREE_001",
    "source_id": "JFK_TREE",
    "speaker": "John F. Kennedy",
    "asset_id": "JFK_TREE",
    "media_path": null,
    "source_sha256": null,
    "source_in_ms": null,
    "source_out_ms": null,
    "verbatim_transcript": null,
    "context_before": null,
    "context_after": null,
    "claim_class": "context_only",
    "narrative_function": "Peace and historical setup",
    "verification_status": "unverified",
    "rights_status": "unknown",
    "rights_evidence_path": null,
    "context_review_path": null,
    "acquisition_evidence_path": null,
    "reviewer": null,
    "publish_approved": false,
    "editorial_notes": "Not direct testimony about Jesus; label context-only",
    "caption_cues": []
  },
  {
    "clip_id": "BUSH_DEBATE_001",
    "source_id": "BUSH_DEBATE",
    "speaker": "George W. Bush",
    "asset_id": "BUSH_DEBATE",
    "media_path": null,
    "source_sha256": null,
    "source_in_ms": null,
    "source_out_ms": null,
    "verbatim_transcript": null,
    "context_before": null,
    "context_after": null,
    "claim_class": "explicit_jesus_testimony",
    "narrative_function": "Personal testimony",
    "verification_status": "unverified",
    "rights_status": "unknown",
    "rights_evidence_path": null,
    "context_review_path": null,
    "acquisition_evidence_path": null,
    "reviewer": null,
    "publish_approved": false,
    "editorial_notes": "C-SPAN rights",
    "caption_cues": []
  },
  {
    "clip_id": "ELIZABETH_XMAS_001",
    "source_id": "ELIZABETH_XMAS",
    "speaker": "Elizabeth II",
    "asset_id": "ELIZABETH_XMAS",
    "media_path": null,
    "source_sha256": null,
    "source_in_ms": null,
    "source_out_ms": null,
    "verbatim_transcript": null,
    "context_before": null,
    "context_after": null,
    "claim_class": "christian_ethics",
    "narrative_function": "Reconciliation",
    "verification_status": "unverified",
    "rights_status": "unknown",
    "rights_evidence_path": null,
    "context_review_path": null,
    "acquisition_evidence_path": null,
    "reviewer": null,
    "publish_approved": false,
    "editorial_notes": "Broadcaster rights",
    "caption_cues": []
  },
  {
    "clip_id": "OBAMA_EASTER_001",
    "source_id": "OBAMA_EASTER",
    "speaker": "Barack Obama",
    "asset_id": "OBAMA_EASTER",
    "media_path": null,
    "source_sha256": null,
    "source_in_ms": null,
    "source_out_ms": null,
    "verbatim_transcript": null,
    "context_before": null,
    "context_after": null,
    "claim_class": "christian_ethics",
    "narrative_function": "Ethics and service",
    "verification_status": "unverified",
    "rights_status": "unknown",
    "rights_evidence_path": null,
    "context_review_path": null,
    "acquisition_evidence_path": null,
    "reviewer": null,
    "publish_approved": false,
    "editorial_notes": "Confirm footage",
    "caption_cues": []
  },
  {
    "clip_id": "MANDELA_EASTER_001",
    "source_id": "MANDELA_EASTER",
    "speaker": "Nelson Mandela",
    "asset_id": "MANDELA_EASTER",
    "media_path": null,
    "source_sha256": null,
    "source_in_ms": null,
    "source_out_ms": null,
    "verbatim_transcript": null,
    "context_before": null,
    "context_after": null,
    "claim_class": "context_only",
    "narrative_function": "Resurrection and reconciliation",
    "verification_status": "unverified",
    "rights_status": "unknown",
    "rights_evidence_path": null,
    "context_review_path": null,
    "acquisition_evidence_path": null,
    "reviewer": null,
    "publish_approved": false,
    "editorial_notes": "Transcript lead; matching footage not confirmed",
    "caption_cues": []
  },
  {
    "clip_id": "COLLINS_TESTIMONY_001",
    "source_id": "COLLINS_TESTIMONY",
    "speaker": "Francis Collins",
    "asset_id": "COLLINS_TESTIMONY",
    "media_path": null,
    "source_sha256": null,
    "source_in_ms": null,
    "source_out_ms": null,
    "verbatim_transcript": null,
    "context_before": null,
    "context_after": null,
    "claim_class": "explicit_jesus_testimony",
    "narrative_function": "Science and conversion",
    "verification_status": "source_confirmed",
    "rights_status": "unknown",
    "rights_evidence_path": null,
    "context_review_path": null,
    "acquisition_evidence_path": null,
    "reviewer": null,
    "publish_approved": false,
    "editorial_notes": "Producer permission",
    "caption_cues": []
  },
  {
    "clip_id": "LENNOX_RESURRECTION_001",
    "source_id": "LENNOX_RESURRECTION",
    "speaker": "John Lennox",
    "asset_id": "LENNOX_RESURRECTION",
    "media_path": null,
    "source_sha256": null,
    "source_in_ms": null,
    "source_out_ms": null,
    "verbatim_transcript": null,
    "context_before": null,
    "context_after": null,
    "claim_class": "christological_argument",
    "narrative_function": "Intellectual argument",
    "verification_status": "unverified",
    "rights_status": "unknown",
    "rights_evidence_path": null,
    "context_review_path": null,
    "acquisition_evidence_path": null,
    "reviewer": null,
    "publish_approved": false,
    "editorial_notes": "Verify source and permissions; identify as mathematician",
    "caption_cues": []
  },
  {
    "clip_id": "BONO_MEANING_001",
    "source_id": "BONO_MEANING",
    "speaker": "Bono",
    "asset_id": "BONO_MEANING",
    "media_path": null,
    "source_sha256": null,
    "source_in_ms": null,
    "source_out_ms": null,
    "verbatim_transcript": null,
    "context_before": null,
    "context_after": null,
    "claim_class": "christological_argument",
    "narrative_function": "Artist and belief",
    "verification_status": "source_confirmed",
    "rights_status": "unknown",
    "rights_evidence_path": null,
    "context_review_path": null,
    "acquisition_evidence_path": null,
    "reviewer": null,
    "publish_approved": false,
    "editorial_notes": "Broadcaster rights; verify full original",
    "caption_cues": []
  },
  {
    "clip_id": "CARREY_HOMEBOY_001",
    "source_id": "CARREY_HOMEBOY",
    "speaker": "Jim Carrey",
    "asset_id": "CARREY_HOMEBOY",
    "media_path": null,
    "source_sha256": null,
    "source_in_ms": null,
    "source_out_ms": null,
    "verbatim_transcript": null,
    "context_before": null,
    "context_after": null,
    "claim_class": "christian_ethics",
    "narrative_function": "Suffering and grace",
    "verification_status": "unverified",
    "rights_status": "unknown",
    "rights_evidence_path": null,
    "context_review_path": null,
    "acquisition_evidence_path": null,
    "reviewer": null,
    "publish_approved": false,
    "editorial_notes": "Context and producer permission",
    "caption_cues": []
  },
  {
    "clip_id": "DENZEL_BERNARD_001",
    "source_id": "DENZEL_BERNARD",
    "speaker": "Denzel Washington",
    "asset_id": "DENZEL_BERNARD",
    "media_path": null,
    "source_sha256": null,
    "source_in_ms": null,
    "source_out_ms": null,
    "verbatim_transcript": null,
    "context_before": null,
    "context_after": null,
    "claim_class": "explicit_jesus_testimony",
    "narrative_function": "Spiritual transformation",
    "verification_status": "unverified",
    "rights_status": "unknown",
    "rights_evidence_path": null,
    "context_review_path": null,
    "acquisition_evidence_path": null,
    "reviewer": null,
    "publish_approved": false,
    "editorial_notes": "Social excerpt; find full source",
    "caption_cues": []
  },
  {
    "clip_id": "CURRY_MVP_001",
    "source_id": "CURRY_MVP",
    "speaker": "Stephen Curry",
    "asset_id": "CURRY_MVP",
    "media_path": null,
    "source_sha256": null,
    "source_in_ms": null,
    "source_out_ms": null,
    "verbatim_transcript": null,
    "context_before": null,
    "context_after": null,
    "claim_class": "explicit_jesus_testimony",
    "narrative_function": "Faith amid victory",
    "verification_status": "unverified",
    "rights_status": "unknown",
    "rights_evidence_path": null,
    "context_review_path": null,
    "acquisition_evidence_path": null,
    "reviewer": null,
    "publish_approved": false,
    "editorial_notes": "NBA/broadcast rights",
    "caption_cues": []
  },
  {
    "clip_id": "SCHEFFLER_MASTERS_001",
    "source_id": "SCHEFFLER_MASTERS",
    "speaker": "Scottie Scheffler",
    "asset_id": "SCHEFFLER_MASTERS",
    "media_path": null,
    "source_sha256": null,
    "source_in_ms": null,
    "source_out_ms": null,
    "verbatim_transcript": null,